{
  "schema_version": "lab.workload_demand_profile.v1",
  "profile_id": "WORKLOAD-DEMAND-001",
  "run_id": "LAB-RUN-workload-001",
  "workload_id": "pi4_representative_smoke",
  "target_id": "target55",
  "execution_mode": "target_local",
  "demand_scope": "process_scoped",
  "workload_demand": {
    "process_cpu_utime_ticks": 12,
    "process_cpu_stime_ticks": 2,
    "process_cpu_time_ms": 140.0,
    "process_cpu_percent_avg": 28.0,
    "process_cpu_percent_peak": 50.0,
    "rss_peak_kb": 4096,
    "vmhwm_peak_kb": 4096,
    "read_bytes": 65536,
    "write_bytes": 65536,
    "cancelled_write_bytes": 0,
    "voluntary_ctxt_switches": 4,
    "nonvoluntary_ctxt_switches": 1,
    "duty_cycle": "bounded_burst",
    "child_process_accounting_status": "unsupported"
  },
  "target_conditioned_response": {
    "portable_between_targets": false,
    "thermal_max_c": 60.5,
    "thermal_margin_c": 14.5,
    "freq_range_khz": [600000, 1800000],
    "abort_reason": null
  },
  "system_context": {
    "system_cpu_percent_avg": 35.0,
    "system_memory_available_min_kb": 7340032,
    "background_activity_confounder": "measured_partial"
  },
  "data_quality": {
    "degraded": false,
    "missing": [],
    "notes": [
      "process CPU time assumes CLK_TCK=100 for v1 Linux targets",
      "child process demand is not aggregated in v1"
    ]
  },
  "evidence_refs": [
    "artifact://lab/runs/LAB-RUN-workload-001/workloads/pi4_representative_smoke/workload_run_result.json"
  ],
  "time_unix_ms": 1780000000501
}
